{"R2-T05_allowed_to_start":false,"R3_allowed_to_start":false,"decision_units":[{"decision":null,"decision_unit":"S_PCT×W120","decision_vocabulary":["accept","reject","defer"],"rationale":null,"selected_candidate_cell_id":null},{"decision":null,"decision_unit":"S_PCT×W250","decision_vocabulary":["accept","reject","defer"],"rationale":null,"selected_candidate_cell_id":null},{"decision":null,"decision_unit":"S_PCVT×W120","decision_vocabulary":["accept","reject","defer"],"rationale":null,"selected_candidate_cell_id":null},{"decision":null,"decision_unit":"S_PCVT×W250","decision_vocabulary":["accept","reject","defer"],"rationale":null,"selected_candidate_cell_id":null}],"formal_task_completed":false,"phase":"A","task_id":"R2-T04","user_decision_status":"pending"}
